[
  {
    "edge_id": "CPA-EDGE-0001",
    "source_node": "CPA-PRE-OLA",
    "source_node_type": "precursor_metabolite",
    "relation": "BIOSYNTHETIC_INPUT_TO",
    "target_node": "CPA-CAN-0032",
    "target_node_type": "compound",
    "confidence": "HIGH",
    "evidence_lane": "biosynthesis",
    "source_id": "SRC-BIOSYNTHESIS-2021",
    "source_url": "https://pmc.ncbi.nlm.nih.gov/articles/PMC7962319/",
    "note": "OLA + GPP are combined to form CBGA."
  },
  {
    "edge_id": "CPA-EDGE-0002",
    "source_node": "CPA-PRE-GPP",
    "source_node_type": "precursor_metabolite",
    "relation": "BIOSYNTHETIC_INPUT_TO",
    "target_node": "CPA-CAN-0032",
    "target_node_type": "compound",
    "confidence": "HIGH",
    "evidence_lane": "biosynthesis",
    "source_id": "SRC-BIOSYNTHESIS-2021",
    "source_url": "https://pmc.ncbi.nlm.nih.gov/articles/PMC7962319/",
    "note": "OLA + GPP are combined to form CBGA."
  },
  {
    "edge_id": "CPA-EDGE-0003",
    "source_node": "CPA-CAN-0032",
    "source_node_type": "compound",
    "relation": "BIOSYNTHETIC_PRECURSOR_OF",
    "target_node": "CPA-CAN-0002",
    "target_node_type": "compound",
    "confidence": "HIGH",
    "evidence_lane": "biosynthesis",
    "source_id": "SRC-BIOSYNTHESIS-2021",
    "source_url": "https://pmc.ncbi.nlm.nih.gov/articles/PMC7962319/",
    "note": "Via THCA synthase."
  },
  {
    "edge_id": "CPA-EDGE-0004",
    "source_node": "CPA-CAN-0032",
    "source_node_type": "compound",
    "relation": "BIOSYNTHETIC_PRECURSOR_OF",
    "target_node": "CPA-CAN-0048",
    "target_node_type": "compound",
    "confidence": "HIGH",
    "evidence_lane": "biosynthesis",
    "source_id": "SRC-BIOSYNTHESIS-2021",
    "source_url": "https://pmc.ncbi.nlm.nih.gov/articles/PMC7962319/",
    "note": "Via CBDA synthase."
  },
  {
    "edge_id": "CPA-EDGE-0005",
    "source_node": "CPA-CAN-0032",
    "source_node_type": "compound",
    "relation": "BIOSYNTHETIC_PRECURSOR_OF",
    "target_node": "CPA-CAN-0068",
    "target_node_type": "compound",
    "confidence": "HIGH",
    "evidence_lane": "biosynthesis",
    "source_id": "SRC-BIOSYNTHESIS-2021",
    "source_url": "https://pmc.ncbi.nlm.nih.gov/articles/PMC7962319/",
    "note": "Via CBCA synthase."
  },
  {
    "edge_id": "CPA-EDGE-0006",
    "source_node": "CPA-CAN-0032",
    "source_node_type": "compound",
    "relation": "DECARBOXYLATES_TO",
    "target_node": "CPA-CAN-0031",
    "target_node_type": "compound",
    "confidence": "HIGH",
    "evidence_lane": "transformation",
    "source_id": "SRC-BIOSYNTHESIS-2021",
    "source_url": "https://pmc.ncbi.nlm.nih.gov/articles/PMC7962319/",
    "note": "Non-enzymatic decarboxylation can occur with storage/heat."
  },
  {
    "edge_id": "CPA-EDGE-0007",
    "source_node": "CPA-CAN-0002",
    "source_node_type": "compound",
    "relation": "DECARBOXYLATES_TO",
    "target_node": "CPA-CAN-0001",
    "target_node_type": "compound",
    "confidence": "HIGH",
    "evidence_lane": "transformation",
    "source_id": "SRC-BIOSYNTHESIS-2021",
    "source_url": "https://pmc.ncbi.nlm.nih.gov/articles/PMC7962319/",
    "note": ""
  },
  {
    "edge_id": "CPA-EDGE-0008",
    "source_node": "CPA-CAN-0048",
    "source_node_type": "compound",
    "relation": "DECARBOXYLATES_TO",
    "target_node": "CPA-CAN-0047",
    "target_node_type": "compound",
    "confidence": "HIGH",
    "evidence_lane": "transformation",
    "source_id": "SRC-BIOSYNTHESIS-2021",
    "source_url": "https://pmc.ncbi.nlm.nih.gov/articles/PMC7962319/",
    "note": ""
  },
  {
    "edge_id": "CPA-EDGE-0009",
    "source_node": "CPA-CAN-0068",
    "source_node_type": "compound",
    "relation": "DECARBOXYLATES_TO",
    "target_node": "CPA-CAN-0067",
    "target_node_type": "compound",
    "confidence": "HIGH",
    "evidence_lane": "transformation",
    "source_id": "SRC-BIOSYNTHESIS-2021",
    "source_url": "https://pmc.ncbi.nlm.nih.gov/articles/PMC7962319/",
    "note": ""
  },
  {
    "edge_id": "CPA-EDGE-0010",
    "source_node": "CPA-CAN-0036",
    "source_node_type": "compound",
    "relation": "DECARBOXYLATES_TO",
    "target_node": "CPA-CAN-0035",
    "target_node_type": "compound",
    "confidence": "HIGH",
    "evidence_lane": "transformation",
    "source_id": "SRC-WELLING-2022",
    "source_url": "https://doi.org/10.1016/j.phytochem.2022.113282",
    "note": "Varin acid/neutral relationship."
  },
  {
    "edge_id": "CPA-EDGE-0011",
    "source_node": "CPA-CAN-0007",
    "source_node_type": "compound",
    "relation": "DECARBOXYLATES_TO",
    "target_node": "CPA-CAN-0006",
    "target_node_type": "compound",
    "confidence": "HIGH",
    "evidence_lane": "transformation",
    "source_id": "SRC-WELLING-2022",
    "source_url": "https://doi.org/10.1016/j.phytochem.2022.113282",
    "note": ""
  },
  {
    "edge_id": "CPA-EDGE-0012",
    "source_node": "CPA-CAN-0052",
    "source_node_type": "compound",
    "relation": "DECARBOXYLATES_TO",
    "target_node": "CPA-CAN-0051",
    "target_node_type": "compound",
    "confidence": "HIGH",
    "evidence_lane": "transformation",
    "source_id": "SRC-WELLING-2022",
    "source_url": "https://doi.org/10.1016/j.phytochem.2022.113282",
    "note": ""
  },
  {
    "edge_id": "CPA-EDGE-0013",
    "source_node": "CPA-CAN-0127",
    "source_node_type": "compound",
    "relation": "DECARBOXYLATES_TO",
    "target_node": "CPA-CAN-0024",
    "target_node_type": "compound",
    "confidence": "HIGH",
    "evidence_lane": "transformation",
    "source_id": "SRC-LINCIANO-2021",
    "source_url": "https://doi.org/10.1016/j.talanta.2021.122704",
    "note": "THCPA is the acid precursor of THCP."
  },
  {
    "edge_id": "CPA-EDGE-0014",
    "source_node": "CPA-CAN-0126",
    "source_node_type": "compound",
    "relation": "DECARBOXYLATES_TO",
    "target_node": "CPA-CAN-0055",
    "target_node_type": "compound",
    "confidence": "HIGH",
    "evidence_lane": "transformation",
    "source_id": "SRC-LINCIANO-2021",
    "source_url": "https://doi.org/10.1016/j.talanta.2021.122704",
    "note": "CBDPA is the acid precursor of CBDP."
  },
  {
    "edge_id": "CPA-EDGE-0015",
    "source_node": "CPA-CAN-0001",
    "source_node_type": "compound",
    "relation": "OXIDIZES_TO",
    "target_node": "CPA-CAN-0076",
    "target_node_type": "compound",
    "confidence": "HIGH",
    "evidence_lane": "transformation",
    "source_id": "SRC-BIOSYNTHESIS-2021",
    "source_url": "https://pmc.ncbi.nlm.nih.gov/articles/PMC7962319/",
    "note": "Δ9-THC can oxidize/aromatize toward CBN during aging/exposure."
  },
  {
    "edge_id": "CPA-EDGE-0016",
    "source_node": "CPA-CAN-0002",
    "source_node_type": "compound",
    "relation": "OXIDIZES_TO",
    "target_node": "CPA-CAN-0077",
    "target_node_type": "compound",
    "confidence": "MEDIUM_HIGH",
    "evidence_lane": "transformation",
    "source_id": "SRC-BIOSYNTHESIS-2021",
    "source_url": "https://pmc.ncbi.nlm.nih.gov/articles/PMC7962319/",
    "note": "THCA → CBNA is represented as an oxidation relationship in review literature."
  },
  {
    "edge_id": "CPA-EDGE-0017",
    "source_node": "CPA-CAN-0077",
    "source_node_type": "compound",
    "relation": "DECARBOXYLATES_TO",
    "target_node": "CPA-CAN-0076",
    "target_node_type": "compound",
    "confidence": "HIGH",
    "evidence_lane": "transformation",
    "source_id": "SRC-BIOSYNTHESIS-2021",
    "source_url": "https://pmc.ncbi.nlm.nih.gov/articles/PMC7962319/",
    "note": ""
  },
  {
    "edge_id": "CPA-EDGE-0018",
    "source_node": "CPA-CAN-0001",
    "source_node_type": "compound",
    "relation": "ISOMERIZES_TO",
    "target_node": "CPA-CAN-0026",
    "target_node_type": "compound",
    "confidence": "MEDIUM",
    "evidence_lane": "transformation",
    "source_id": "SRC-HANUS-2016",
    "source_url": "https://doi.org/10.1039/C6NP00074F",
    "note": "Δ8-THC can arise through non-enzymatic transformation/isomerization; this edge is not a claim that all Δ8-THC is an artifact."
  },
  {
    "edge_id": "CPA-EDGE-0019",
    "source_node": "CPA-CAN-0068",
    "source_node_type": "compound",
    "relation": "PHOTOCYCLIZES_TO",
    "target_node": "CPA-CAN-0065",
    "target_node_type": "compound",
    "confidence": "MEDIUM_HIGH",
    "evidence_lane": "transformation",
    "source_id": "SRC-HANUS-2016",
    "source_url": "https://doi.org/10.1039/C6NP00074F",
    "note": "CBCA → CBLA under irradiation/photochemical conditions."
  },
  {
    "edge_id": "CPA-EDGE-0020",
    "source_node": "CPA-CAN-0067",
    "source_node_type": "compound",
    "relation": "PHOTOCYCLIZES_TO",
    "target_node": "CPA-CAN-0064",
    "target_node_type": "compound",
    "confidence": "MEDIUM_HIGH",
    "evidence_lane": "transformation",
    "source_id": "SRC-HANUS-2016",
    "source_url": "https://doi.org/10.1039/C6NP00074F",
    "note": "CBC → CBL under irradiation/photochemical conditions."
  },
  {
    "edge_id": "CPA-EDGE-0021",
    "source_node": "CPA-CAN-0065",
    "source_node_type": "compound",
    "relation": "DECARBOXYLATES_TO",
    "target_node": "CPA-CAN-0064",
    "target_node_type": "compound",
    "confidence": "HIGH",
    "evidence_lane": "transformation",
    "source_id": "SRC-HANUS-2016",
    "source_url": "https://doi.org/10.1039/C6NP00074F",
    "note": ""
  },
  {
    "edge_id": "CPA-EDGE-0022",
    "source_node": "CPA-CAN-0001",
    "source_node_type": "compound",
    "relation": "STEREOISOMER_OF",
    "target_node": "CPA-CAN-0101",
    "target_node_type": "compound",
    "confidence": "HIGH",
    "evidence_lane": "structure",
    "source_id": "SRC-RADWAN-2021",
    "source_url": "https://doi.org/10.3390/molecules26092774",
    "note": "trans/cis Δ9-THC records."
  },
  {
    "edge_id": "CPA-EDGE-0023",
    "source_node": "CPA-CAN-0002",
    "source_node_type": "compound",
    "relation": "STEREOISOMER_OF",
    "target_node": "CPA-CAN-0133",
    "target_node_type": "compound",
    "confidence": "HIGH",
    "evidence_lane": "structure",
    "source_id": "SRC-CIS-THCA-2022",